ID,Region,State,Code,Name,Type,Visitors
1967105,PW,CA,POCH,Port Chicago Naval Magazine National Memorial,National Memorial,6349
1971618,NE,MA,FRLA,Frederick Law Olmsted National Historic Site,National Historic Site,187202
1985525,NC,DC,KOWA,Korean War Veterans Memorial,National Memorial,64663281
1986829,PW,ID,CRMO,Craters of the Moon National Monument,National Monument,13044205
1986830,NE,PA,FLNI,Flight 93 National Memorial,National Memorial,2422983
1989142,NC,DC,WWII,World War II Memorial,National Memorial,55978113
1993781,SE,VI,CHRI,Christiansted National Historic Site,National Historic Site,4805816
1993989,SE,VI,SARI,Salt River Bay National Historical Park and Ecological Preserve,National Historical Park,51085
2002666,NC,DC,MLKM,"Martin Luther King, Jr., Memorial",Other Designation,18802093
2026588,PW,CA,RORI,Rosie the Riveter/World War II Home Front National Historical Park,National Historical Park,197850
2035095,SE,SC,CONG,Congaree National Park,National Park,2629690
2035603,NE,NY,THRI,Theodore Roosevelt Inaugural National Historic Site,National Historic Site,933526
2035610,MW,OH,FILA,First Ladies National Historic Site,National Historic Site,120928
2053533,NE,NJ,PAGR,Paterson Great Falls National Historical Park,National Historical Park,177498
2055170,PW,WA,LEWI,Lewis and Clark National Historical Park,National Historical Park,9515314
2057537,NE,NY,FEHA,Federal Hall National Memorial,National Memorial,9876807
2060434,NE,NY,AFBG,African Burial Ground National Monument,National Monument,554291
2083047,NE,NY,THRB,Theodore Roosevelt Birthplace National Historic Site,National Historic Site,740398
2083660,NE,NY,HAGR,Hamilton Grange National Memorial,National Memorial,734123
2091841,MW,AR,CHSC,Little Rock Central High School National Historic Site,National Historic Site,1000434
2092022,NE,NY,GOIS,Governors Island National Monument,National Monument,3843259
2127375,IM,CO,SAND,Sand Creek Massacre National Historic Site,National Historic Site,37313
2463113,MW,MO,HSTR,Harry S Truman National Historic Site,National Historic Site,2040847
2492338,SE,AL,TUAI,Tuskegee Airmen National Historic Site,National Historic Site,365883
2510335,MW,KS,BRVB,Brown v. Board of Education National Historic Site,National Historic Site,270456
2559483,IM,CO,BEOL,Bent's Old Fort National Historic Site,National Historic Site,2063448
2733411,MW,SD,MNRR,Missouri National Recreation River,National Recreation River,1886564
2733416,SE,FL,TIMU,Timucuan Ecological and Historic Preserve,Ecological and Historic Preserve,18018607
2733420,NC,DC,THIS,Theodore Roosevelt Island,National Memorial,5602184
2733421,IM,WY,DETO,Devils Tower National Monument,National Monument,18329938
2733422,NC,DC,MABE,Mary McLeod Bethune Council House National Historic Site,National Historic Site,202237
2733423,NC,DC,FRDO,Frederick Douglass National Historic Site,National Historic Site,2100875
2733424,NE,NY,GEGR,General Grant National Memorial,National Memorial,5959659
2733425,MW,MO,ULSG,Ulysses S. Grant National Historic Site,National Historic Site,658952
2733426,NC,MD,CLBA,Clara Barton National Historic Site,National Historic Site,607242
2733428,SE,LA,CARI,Cane River Creole National Historical Park,National Historical Park,367437
2733430,NC,DC,WHHO,White House,Other Designation,65699749
2733431,PW,HI,VALR,World War II Valor in the Pacific National Monument,National Monument,51327698
2733432,MW,AR,ARPO,Arkansas Post National Memorial,National Memorial,2709228
2733433,MW,AR,WICL,President William Jefferson Clinton Birthplace Home National Historic Site,National Historic Site,60563
2733434,MW,MI,RIRA,River Raisin National Battlefield Park,National Battlefield Park,511111
2733436,NE,MA,NEBE,New Bedford Whaling National Historical Park,National Historical Park,5115941
2733437,NE,MA,LONG,Longfellow House-Washington's Headquarters National Historic Site,National Historic Site,978343
2733439,NC,DC,PAAV,Pennsylvania Avenue National Historic Site,National Historic Site,6442966
2733440,MW,KS,NICO,Nicodemus National Historic Site,National Historic Site,296433
2733442,MW,SD,MIMI,Minuteman Missile National Historic Site,National Historic Site,671529
2733443,IM,CO,GRSA,Great Sand Dunes National Preserve,National Preserve,13526909
2736075,MW,OH,CHYO,Charles Young Buffalo Soldiers National Monument,National Monument,14204
2738287,NC,DC,NACA,National Capital Parks,Park,236187845
2754548,PW,CA,CECH,Casar E. Chpvez National Monument,National Monument,44875
2760439,AK,AK,DENA,Denali National Preserve,National Park,17923704
2766087,IM,TX,RIGR,Rio Grande Wild and Scenic River,Wild and Scenic River,22754
2775864,IM,NM,MAPR,Manhattan Project National Historical Park,National Historical Park,104715
2775865,IM,TX,WACO,Waco Mammoth National Monument,National Monument,90061
2775875,NC,DC,BEPA,Belmont-Paul Women's Equality National Monument,National Monument,2704
